[
  {
    "id": "FEAT-01",
    "project": "web",
    "area": "features",
    "title": "Use feature public APIs across boundaries",
    "rule": "Feature code must import another feature through its public API, not through deep internal component, hook, service, data, or generated paths.",
    "check": "Did this change cross a feature boundary? If yes, are imports going through the target feature's public API?",
    "exampleRefs": ["web/examples/feature-boundaries.md#feature-public-api"],
    "reviewLearningIds": ["RL-20260326-001"]
  },
  {
    "id": "FEAT-02",
    "project": "web",
    "area": "features",
    "title": "Give new features the standard boundary",
    "rule": "New web features need an explicit boundary: public barrel, feature contract or handle where applicable, public types, and hooks exported without lazy-loading hook calls.",
    "check": "Did this add or expand a feature? If yes, does it have the expected public API boundary instead of making consumers import internals?",
    "exampleRefs": ["web/examples/feature-boundaries.md#feature-public-api"],
    "reviewLearningIds": ["RL-20260327-004"]
  },
  {
    "id": "CODE-01",
    "project": "web",
    "area": "abstractions",
    "title": "Extract shared UI only when behavior is actually shared",
    "rule": "When two components share form, state, loading, and error flow, prefer one configurable component over near-duplicate implementations.",
    "check": "Did this add a component that mirrors an existing workflow? If yes, can the existing component accept the small differences as props?",
    "exampleRefs": [
      "web/examples/feature-boundaries.md#shared-form-components",
      "web/examples/feature-boundaries.md#code-01-fold-near-duplicate-sign-in-buttons-into-one-configurable-component",
      "web/examples/feature-boundaries.md#code-01-extract-embedded-error-boundaries-from-unrelated-ui-components"
    ],
    "reviewLearningIds": ["RL-20260327-006", "RL-20260331-006", "RL-20260505-006", "RL-20260505-011"]
  },
  {
    "id": "CODE-02",
    "project": "web",
    "area": "abstractions",
    "title": "Extract repeated styling into named structure",
    "rule": "Repeated or long styling patterns should move into a small component, class helper, or CSS module when that makes call sites readable and consistent.",
    "check": "Did this repeat a long class list, shadow, or layout pattern? If yes, should it be named once and reused?",
    "exampleRefs": ["web/examples/feature-boundaries.md#repeated-style-shape"],
    "reviewLearningIds": ["RL-20260413-003", "RL-20260424-001"]
  },
  {
    "id": "WEB-01",
    "project": "web",
    "area": "auth",
    "title": "Make auth/session effects hydration-aware",
    "rule": "Effects that depend on persisted auth state must observe hydration or the relevant hydrated value instead of capturing initial empty state forever.",
    "check": "Did this effect read persisted auth/session state? If yes, does it re-run after hydration or depend on the hydrated value?",
    "exampleRefs": ["examples/general/gateway-hooks.md#hydration-aware-effects"],
    "reviewLearningIds": ["RL-20260420-002", "RL-20260504-001", "RL-20260506-002"]
  },
  {
    "id": "WEB-02",
    "project": "web",
    "area": "auth",
    "title": "Keep deliberate logout distinct from session expiry",
    "rule": "Logout flows must clear client auth state before navigation or otherwise suppress session-expired handling while logout is in flight.",
    "check": "Did this change logout, auth hydration, or credentialed 403 handling? If yes, can a deliberate logout race show a session-expired toast?",
    "exampleRefs": ["examples/general/gateway-hooks.md#logout-session-races"],
    "reviewLearningIds": ["RL-20260506-004"]
  },
  {
    "id": "WEB-03",
    "project": "web",
    "area": "auth",
    "title": "Use fresh server probes for auth transitions",
    "rule": "Auth reconciliation and login/logout callbacks must not rely on cached RTK Query data when the backend cookie state is the source of truth.",
    "check": "Did this check current auth after a login/logout/callback transition? If yes, does it force a fresh backend probe and avoid a lingering subscription?",
    "exampleRefs": [
      "examples/general/gateway-hooks.md#fresh-auth-probes",
      "examples/general/gateway-hooks.md#web-03-force-unauthenticated-on-transient-reconcile-errors"
    ],
    "reviewLearningIds": ["RL-20260324-001", "RL-20260407-005", "RL-20260413-001"]
  },
  {
    "id": "API-01",
    "project": "general",
    "area": "api",
    "title": "Search consumers when removing public exports",
    "rule": "Removing or changing a public export, hook return field, endpoint, or compatibility API requires updating all tests and consumers in the same change.",
    "check": "Did this remove or rename an exported API? If yes, were tests, namespace imports, dynamic access, generated consumers, and downstream apps searched?",
    "exampleRefs": [
      "examples/general/api-and-packages.md#api-01-drop-in-replacements-preserve-the-original-prop-surface"
    ],
    "reviewLearningIds": ["RL-20260410-002", "RL-20260428-003", "RL-20260506-003"]
  },
  {
    "id": "API-02",
    "project": "general",
    "area": "api",
    "title": "Make additive hook registration idempotent",
    "rule": "Initializers that append global hooks must be idempotent or retain and call the deregister callback before re-registering.",
    "check": "Did this replace a setter with an additive hook API or register a global hook? If yes, is repeated initialization safe?",
    "exampleRefs": ["examples/general/gateway-hooks.md#idempotent-response-hooks"],
    "reviewLearningIds": ["RL-20260506-005"]
  },
  {
    "id": "API-03",
    "project": "general",
    "area": "api",
    "title": "Do not hand-edit generated clients as durable source",
    "rule": "Generated gateway files must come from schema/codegen. Temporary hand edits need an explicit generator path or they will be overwritten.",
    "check": "Did this touch AUTO_GENERATED or schema-derived files? If yes, can codegen reproduce the change?",
    "exampleRefs": [
      "examples/general/api-and-packages.md#api-03-import-from-package-public-entrypoints-not-deep-dist-paths"
    ],
    "reviewLearningIds": ["RL-20260415-008"]
  },
  {
    "id": "RTK-01",
    "project": "general",
    "area": "state",
    "title": "Handle RTK mutation results explicitly",
    "rule": "RTK Query mutation triggers resolve with a result object; use `.unwrap()` or inspect `result.error` before updating success UI or local state.",
    "check": "Did this call an RTK mutation? If yes, does success state happen only after confirmed success?",
    "exampleRefs": [
      "examples/general/data-integrity.md#rtk-mutation-results",
      "examples/general/gateway-hooks.md#rtk-01-unwrap-mutations-before-mutating-state-on-success"
    ],
    "reviewLearningIds": ["RL-20260407-004", "RL-20260505-004"]
  },
  {
    "id": "RTK-02",
    "project": "general",
    "area": "state",
    "title": "Choose loading flags by UX meaning",
    "rule": "`isLoading` represents the first load; `isFetching` also covers refetches. Use the flag that matches whether existing data should remain visible.",
    "check": "Did this show a spinner from RTK Query state? If yes, should refetch hide existing content or only the initial load?",
    "exampleRefs": [
      "examples/general/data-integrity.md#loading-vs-fetching",
      "examples/general/data-integrity.md#rtk-02-skip-queries-until-the-resource-id-is-resolved"
    ],
    "reviewLearningIds": ["RL-20260415-006", "RL-20260420-001"]
  },
  {
    "id": "DATA-01",
    "project": "general",
    "area": "data",
    "title": "Preserve chain scope in address-like merges",
    "rule": "Address-book and Safe-like merge logic must compare entries at the relevant identity granularity, usually address plus chain ID.",
    "check": "Did this merge contacts, Safes, or address-scoped records? If yes, are non-overlapping chain IDs preserved?",
    "exampleRefs": ["examples/general/data-integrity.md#per-chain-contact-merges"],
    "reviewLearningIds": ["RL-20260415-003", "RL-20260505-002", "RL-20260505-005"]
  },
  {
    "id": "DATA-02",
    "project": "general",
    "area": "data",
    "title": "Empty-state checks must include every visible collection",
    "rule": "UI empty-state predicates must include every collection that can render tabs, rows, actions, or badges.",
    "check": "Did this add a new collection to a view? If yes, do empty states and tab visibility include it?",
    "exampleRefs": ["examples/general/data-integrity.md#data-02-empty-state-gating-across-multiple-collections"],
    "reviewLearningIds": ["RL-20260415-002", "RL-20260505-003"]
  },
  {
    "id": "DATA-03",
    "project": "general",
    "area": "data",
    "title": "Preserve fallback data when adding new response shapes",
    "rule": "When upstream responses gain a new shape, merge field-by-field and preserve legacy fallback mappings for omitted optional sections.",
    "check": "Did this add support for a new response shape? If yes, do partial new payloads still preserve legacy data?",
    "exampleRefs": ["examples/general/data-integrity.md#fallback-preserving-maps"],
    "reviewLearningIds": ["RL-20260409-001"]
  },
  {
    "id": "DATA-04",
    "project": "general",
    "area": "data",
    "title": "Normalize through existing bounded helpers",
    "rule": "Values with established length, version, or encoding limits must go through the existing helper rather than duplicating raw serialization.",
    "check": "Did this create a tx origin, encoded note, Safe version, or similar bounded value? If yes, did it use the canonical helper?",
    "exampleRefs": ["examples/general/chain-contracts.md#normalize-versions-and-origin"],
    "reviewLearningIds": ["RL-20260331-002", "RL-20260402-002", "RL-20260416-001", "RL-20260423-001"]
  },
  {
    "id": "CHAIN-01",
    "project": "general",
    "area": "chain",